{
  "generated_at": "2026-07-22T13:22:15",
  "count": 143,
  "summary": {
    "groups": {
      "metadata": 3,
      "taxonomy": 123,
      "review": 13,
      "quality": 4
    },
    "severity": {
      "high": 9,
      "medium": 130,
      "low": 4
    }
  },
  "actions": [
    {
      "id": "metadata_missing:2512.23424-akg-kernel-agent-multi",
      "group": "metadata",
      "severity": "high",
      "priority": 106,
      "title": "补必填元数据：AKG kernel Agent：用于跨平台 Kernel 合成的多智能体框架",
      "detail": "domains, tracks, problems, reading_stage",
      "href": "library.html?q=2512.23424-akg-kernel-agent-multi",
      "source": "quality.json",
      "slugs": [
        "2512.23424-akg-kernel-agent-multi"
      ],
      "command": "python3 scripts/apply_library_metadata.py docs --input <csv>"
    },
    {
      "id": "metadata_missing:2603.03251-speculative-speculative-decoding",
      "group": "metadata",
      "severity": "high",
      "priority": 106,
      "title": "补必填元数据：推测性推测解码",
      "detail": "domains, tracks, problems, research_line, line_role, reading_stage",
      "href": "library.html?q=2603.03251-speculative-speculative-decoding",
      "source": "quality.json",
      "slugs": [
        "2603.03251-speculative-speculative-decoding"
      ],
      "command": "python3 scripts/apply_library_metadata.py docs --input <csv>"
    },
    {
      "id": "taxonomy_drift:line_role:tooling:2512.23424-akg-kernel-agent-multi",
      "group": "taxonomy",
      "severity": "high",
      "priority": 106,
      "title": "处理 taxonomy drift：AKG kernel Agent：用于跨平台 Kernel 合成的多智能体框架",
      "detail": "line_role = tooling 不在允许值中。",
      "href": "quality.html",
      "source": "quality.json",
      "slugs": [
        "2512.23424-akg-kernel-agent-multi"
      ],
      "command": "python3 scripts/validate_wiki.py docs --strict-taxonomy"
    },
    {
      "id": "taxonomy_action:split_candidate:topics:Speculative Decoding",
      "group": "taxonomy",
      "severity": "high",
      "priority": 100,
      "title": "主题：Speculative Decoding",
      "detail": "主题 过大，考虑拆成更细子类。",
      "href": "library.html?topic=Speculative+Decoding",
      "source": "taxonomy_actions.json",
      "slugs": [
        "2503.14075-twigvlm-plus-plus",
        "2602.06036-dflash",
        "2603.03251-speculative-speculative-decoding",
        "2604.11035-introspective-dlm",
        "2605.12825-orthrus"
      ],
      "command": "python3 scripts/export_taxonomy_actions.py docs --format project --output docs/exports/taxonomy-project.csv"
    },
    {
      "id": "taxonomy_action:split_candidate:tracks:Inference Acceleration",
      "group": "taxonomy",
      "severity": "high",
      "priority": 100,
      "title": "方向：Inference Acceleration",
      "detail": "方向 过大，考虑拆成更细子类。",
      "href": "library.html?track=Inference+Acceleration",
      "source": "taxonomy_actions.json",
      "slugs": [
        "2503.14075-twigvlm-plus-plus",
        "2602.06036-dflash",
        "2604.11035-introspective-dlm",
        "2605.12825-orthrus",
        "2607.00466-eldr"
      ],
      "command": "python3 scripts/export_taxonomy_actions.py docs --format project --output docs/exports/taxonomy-project.csv"
    },
    {
      "id": "taxonomy_action:split_candidate:domains:LLM Systems",
      "group": "taxonomy",
      "severity": "high",
      "priority": 100,
      "title": "结构域：LLM Systems",
      "detail": "结构域 过大，考虑拆成更细子类。",
      "href": "library.html?domain=LLM+Systems",
      "source": "taxonomy_actions.json",
      "slugs": [
        "2503.14075-twigvlm-plus-plus",
        "2602.06036-dflash",
        "2604.11035-introspective-dlm",
        "2605.12825-orthrus",
        "2607.00466-eldr"
      ],
      "command": "python3 scripts/export_taxonomy_actions.py docs --format project --output docs/exports/taxonomy-project.csv"
    },
    {
      "id": "taxonomy_action:split_candidate:status:read",
      "group": "taxonomy",
      "severity": "high",
      "priority": 100,
      "title": "阅读状态：read",
      "detail": "阅读状态 过大，考虑拆成更细子类。",
      "href": "library.html?status=read",
      "source": "taxonomy_actions.json",
      "slugs": [
        "2503.14075-twigvlm-plus-plus",
        "2602.06036-dflash",
        "2603.03251-speculative-speculative-decoding",
        "2604.11035-introspective-dlm",
        "2605.12825-orthrus"
      ],
      "command": "python3 scripts/export_taxonomy_actions.py docs --format project --output docs/exports/taxonomy-project.csv"
    },
    {
      "id": "taxonomy_action:split_candidate:reading_stage:deep_read",
      "group": "taxonomy",
      "severity": "high",
      "priority": 100,
      "title": "阅读阶段：deep_read",
      "detail": "阅读阶段 过大，考虑拆成更细子类。",
      "href": "library.html?stage=deep_read",
      "source": "taxonomy_actions.json",
      "slugs": [
        "2602.06036-dflash",
        "2604.11035-introspective-dlm",
        "2605.12825-orthrus",
        "2607.00466-eldr",
        "2501.01005-flashinfer"
      ],
      "command": "python3 scripts/export_taxonomy_actions.py docs --format project --output docs/exports/taxonomy-project.csv"
    },
    {
      "id": "metadata_missing:semantic-search-evaluation",
      "group": "metadata",
      "severity": "high",
      "priority": 98,
      "title": "补必填元数据：Semantic Search Evaluation",
      "detail": "domains, tracks, problems, methods, research_line, line_role, reading_stage",
      "href": "library.html?q=semantic-search-evaluation",
      "source": "quality.json",
      "slugs": [
        "semantic-search-evaluation"
      ],
      "command": "python3 scripts/apply_library_metadata.py docs --input <csv>"
    },
    {
      "id": "review_plan:2307.08691-flashattention-2",
      "group": "review",
      "severity": "medium",
      "priority": 74,
      "title": "补复习计划：FlashAttention-2：用更好的并行性与工作划分加速 Attention",
      "detail": "建议 next_review = 2026-08-05",
      "href": "2307.08691-flashattention-2.html",
      "source": "review.json",
      "slugs": [
        "2307.08691-flashattention-2"
      ],
      "command": "python3 scripts/apply_review_plan.py docs --write"
    },
    {
      "id": "review_plan:2604.11035-introspective-dlm",
      "group": "review",
      "severity": "medium",
      "priority": 74,
      "title": "补复习计划：内省式扩散语言模型",
      "detail": "建议 next_review = 2026-07-29",
      "href": "2604.11035-introspective-dlm.html",
      "source": "review.json",
      "slugs": [
        "2604.11035-introspective-dlm"
      ],
      "command": "python3 scripts/apply_review_plan.py docs --write"
    },
    {
      "id": "review_plan:2512.23424-akg-kernel-agent-multi",
      "group": "review",
      "severity": "medium",
      "priority": 72,
      "title": "补复习计划：AKG kernel Agent：用于跨平台 Kernel 合成的多智能体框架",
      "detail": "建议 next_review = 2026-08-21",
      "href": "2512.23424-akg-kernel-agent-multi.html",
      "source": "review.json",
      "slugs": [
        "2512.23424-akg-kernel-agent-multi"
      ],
      "command": "python3 scripts/apply_review_plan.py docs --write"
    },
    {
      "id": "review_plan:2602.06036-dflash",
      "group": "review",
      "severity": "medium",
      "priority": 72,
      "title": "补复习计划：DFlash：用于快速 speculative decoding 的块扩散方法",
      "detail": "建议 next_review = 2026-08-14",
      "href": "2602.06036-dflash.html",
      "source": "review.json",
      "slugs": [
        "2602.06036-dflash"
      ],
      "command": "python3 scripts/apply_review_plan.py docs --write"
    },
    {
      "id": "review_plan:noarxiv-2026-dspark",
      "group": "review",
      "severity": "medium",
      "priority": 72,
      "title": "补复习计划：DSpark：基于置信度调度的半自回归 speculative decoding",
      "detail": "建议 next_review = 2026-08-14",
      "href": "noarxiv-2026-dspark.html",
      "source": "review.json",
      "slugs": [
        "noarxiv-2026-dspark"
      ],
      "command": "python3 scripts/apply_review_plan.py docs --write"
    },
    {
      "id": "review_plan:2503.01840-eagle-3-scaling-up",
      "group": "review",
      "severity": "medium",
      "priority": 72,
      "title": "补复习计划：EAGLE-3：通过训练时测试扩展大语言模型推理加速",
      "detail": "建议 next_review = 2026-08-14",
      "href": "2503.01840-eagle-3-scaling-up.html",
      "source": "review.json",
      "slugs": [
        "2503.01840-eagle-3-scaling-up"
      ],
      "command": "python3 scripts/apply_review_plan.py docs --write"
    },
    {
      "id": "review_plan:2607.00466-eldr",
      "group": "review",
      "severity": "medium",
      "priority": 72,
      "title": "补复习计划：ELDR：面向 PD 分离 MoE 服务的专家局部性感知解码路由",
      "detail": "建议 next_review = 2026-08-14",
      "href": "2607.00466-eldr.html",
      "source": "review.json",
      "slugs": [
        "2607.00466-eldr"
      ],
      "command": "python3 scripts/apply_review_plan.py docs --write"
    },
    {
      "id": "review_plan:2501.01005-flashinfer",
      "group": "review",
      "severity": "medium",
      "priority": 72,
      "title": "补复习计划：FlashInfer：面向 LLM 推理服务的高效可定制 Attention 引擎",
      "detail": "建议 next_review = 2026-08-21",
      "href": "2501.01005-flashinfer.html",
      "source": "review.json",
      "slugs": [
        "2501.01005-flashinfer"
      ],
      "command": "python3 scripts/apply_review_plan.py docs --write"
    },
    {
      "id": "review_plan:2605.12825-orthrus",
      "group": "review",
      "severity": "medium",
      "priority": 72,
      "title": "补复习计划：Orthrus：通过双视角扩散实现内存高效的并行 token 生成",
      "detail": "建议 next_review = 2026-08-14",
      "href": "2605.12825-orthrus.html",
      "source": "review.json",
      "slugs": [
        "2605.12825-orthrus"
      ],
      "command": "python3 scripts/apply_review_plan.py docs --write"
    },
    {
      "id": "review_plan:2507.11851-llm-future-mtp",
      "group": "review",
      "severity": "medium",
      "priority": 72,
      "title": "补复习计划：你的 LLM 知道未来：揭示它的多 token 预测潜力",
      "detail": "建议 next_review = 2026-08-14",
      "href": "2507.11851-llm-future-mtp.html",